"ID","FOURNISSEUR_NOM","FOURNISSEUR_REFERENCE","SizesColors","DATE_CREATION","Title","Image","Description","Category","Subcategory","SubSubcategory"
8e6b3b68-842f-43a0-8734-f74b23517214,VANOS,133624,"L/KAKI, L/NOIR, M/KAKI, M/NOIR, S/KAKI, S/NOIR, XL/KAKI, XL/NOIR, XXL/KAKI, XXL/NOIR",30/11/2022,T-Shirt US Army 82nd Airborne,https://www.quaerius.com/35930-large_default/t-shirt-us-army-82nd-airborne.jpg,,Vêtements,Hauts,T-shirts
d94a93bd-e868-4b2f-bf86-92429af66746,VANOS,133641,"L/KAKI, M/KAKI, S/KAKI, XL/KAKI, XXL/KAKI",18/11/2022,T-Shirt Allied Star Punisher,https://www.quaerius.com/35910-large_default/t-shirt-allied-star-punisher.jpg,,Vêtements,Hauts,T-shirts
732482e3-d47c-4831-af05-62c38a5f5fbb,VANOS,135301,"3XL/BLACK, 3XL/RED, L/BLACK, L/RED, M/BLACK, M/RED, S/BLACK, S/RED, XL/BLACK, XL/RED, XXL/BLACK, XXL/RED",18/11/2022,Chemise Bûcheron en Flanelle à Carreaux,https://www.quaerius.com/15039-large_default/chemise-bucheron-flanelle-carreaux-fostex-garments.jpg,La Chemise Bûcheron en Flanelle à Carreaux Longhorn est chaude grâce à sa double épaisseur en flanelle et protège contre la pluie (fine).,Vêtements,Hauts,Chemises
2fa5bdd7-71c8-4193-8ffe-5e564785dcf1,VANOS,213143,"L/BEIGE, L/DIGI, L/DIGITAL, L/ICC, L/KAKI, L/NOIR, L/TIGER, L/WOODLAND, M/BEIGE, M/DIGI, M/DIGITAL, M/ICC, M/KAKI, M/NOIR, M/TIGER, M/WOODLAND, S/BEIGE, S/DIGI, S/DIGITAL, S/ICC, S/KAKI, S/NOIR, S/TIGER, S/WOODLAND, XL/BEIGE, XL/DIGI, XL/DIGITAL, XL/ICC, XL/KAKI, XL/NOIR, XL/TIGER, XL/WOODLAND, L/DESERT, M/DESERT, S/DESERT, XL/DESERT",14/04/2023,Chapeau de Brousse,https://www.quaerius.com/15366-large_default/chapeau-brousse-bob-fostex-garments.jpg,"Le Chapeau de Brousse Fostex Garments est léger et résistant, conçu en coton 100% avec armure Ripstop.",Accessoires,Couvre-chef,
28673669-dfe6-457c-9367-26a09f824249,VANOS,213161,"L/BEIGE, L/KAKI, L/NOIR, M/BEIGE, M/KAKI, M/NOIR, S/BEIGE, S/KAKI, S/NOIR, XL/BEIGE, XL/KAKI, XL/NOIR",27/05/2023,Chapeau de Brousse Ranger,https://www.quaerius.com/17973-large_default/chapeau-de-brousse-ranger-101-incorporated.jpg,"Le chapeau de brousse Ranger 101 Incorporated est composé de coton et dispose d'un cordon de serrage, assurant le maintien du chapeau. Il possède, de plus, des trous d'aérations sur les côtés, ainsi que des passants Molle en velcro sur le tour du chapeau. Il est également équipé d'un compartiment intérieur permettant l'emport d'objets importants.",Accessoires,Couvre-chef,
3aa427e0-7b4f-4a94-9a05-c710f821f742,VANOS,214140,,19/11/2022,Bonnet Thinsulate,https://www.quaerius.com/15322-large_default/bonnet-thinsulate-fostex-garments.jpg,"Le Bonnet Thinsulate Fostex Garments, composé d'acrylique à 100%, offre grâce au tissu Thinsulate une protection optimale contre le froid.",Accessoires,Couvre-chef,
11f8095c-5804-4117-bec9-8890b87719e9,VANOS,214141,,19/11/2022,Bonnet Beanie 101st Airborne,https://www.quaerius.com/33215-large_default/bonnet-beanie-101st-airborne.jpg,,Accessoires,Couvre-chef,
89ee5dca-5ed6-491c-b37a-6fb300b99674,VANOS,214142,,19/11/2022,Bonnet Beanie 82nd Airborne,https://www.quaerius.com/33220-large_default/bonnet-beanie-82nd-airborne.jpg,,Accessoires,Couvre-chef,
f3ec2976-7929-4b7d-8148-4e420c7e544d,VANOS,214143,,19/11/2022,Bonnet Acrylique,https://www.quaerius.com/15288-large_default/bonnet-acrylique-fostex-garments.jpg,Le bonnet Fostex Garments est en 100% acrylique à mailles fines pour se protéger du froid.,Accessoires,Couvre-chef,
a2224fd0-10af-4a64-b59e-784bc8f59e51,VANOS,214288,,30/11/2022,Cagoule Panoramique avec Masque,https://www.quaerius.com/15409-large_default/cagoule-panoramique-avec-masque-fostex-garments.jpg,"La Cagoule Panoramique Fostex Garments est composée de coton à 100%. Elle est légère, dispose d'un masque en tissu léger au niveau du nez pour une meilleure respiration.",Accessoires,Masques,
acc7c624-6cd7-4cb9-abad-127c89fb20bd,VANOS,214300,,19/11/2022,Bonnet Beanie Simple,https://www.quaerius.com/33942-large_default/bonnet-beanie-simple.jpg,,Accessoires,Couvre-chef,
a0f93ac7-a7d3-4ae8-a926-b38ae4173bbc,VANOS,215081,,29/11/2022,Casquette Baseball 2Nd Armored Division,https://www.quaerius.com/34294-large_default/casquette-baseball-2nd-armored-division.jpg,,Accessoires,Couvre-chef,
c8f6012a-3df3-4452-8829-6458f210cf98,VANOS,215091,,14/04/2023,Casquette Baseball Avion P51D,https://www.quaerius.com/34314-large_default/casquette-baseball-avion-p51d.jpg,,Accessoires,Couvre-chef,
52940186-9e50-45f8-b73c-59413e232332,VANOS,215094,,22/11/2022,Casquette Baseball Us Cavalry Wwii,https://www.quaerius.com/34408-large_default/casquette-baseball-us-cavalry-wwii.jpg,,Accessoires,Couvre-chef,
dec0bc91-5d10-49bf-9f2b-feef7499d7a6,VANOS,215112,,19/11/2022,Casquette Baseball Usaf Roundel,https://www.quaerius.com/33637-large_default/casquette-baseball-usaf-roundel.jpg,,Accessoires,Couvre-chef,
17dd85f3-a43b-4c8e-b06c-f31157ad0f7a,VANOS,215116,,29/11/2022,Casquette Baseball Us Army Veteran,https://www.quaerius.com/33633-large_default/casquette-baseball-us-army-veteran.jpg,,Accessoires,Couvre-chef,
f554a41d-745f-4660-94ea-f9954a13b95d,VANOS,215124,,29/11/2022,Casquette Baseball Contractor,https://www.quaerius.com/33509-large_default/casquette-baseball-contractor.jpg,,Accessoires,Couvre-chef,
233f7f19-14d0-419f-ae36-d7149d83f4cf,VANOS,215146,,29/11/2022,Casquette Baseball Sniper,https://www.quaerius.com/38436-large_default/casquette-baseball-sniper.jpg,,Accessoires,Couvre-chef,
454daae3-c068-4cf9-8b72-f5ed5ec1da86,VANOS,215153,,29/11/2022,Casquette Baseball,https://www.quaerius.com/15158-large_default/casquette-baseball-fostex-garments.jpg,La Casquette Baseball Fostex Garments est conçue en coton 100%.,Accessoires,Couvre-chef,
18b44ec9-a601-4b7f-9f02-9d0d03f5224f,VANOS,215158,,29/11/2022,Casquette Baseball Flexfit,https://www.quaerius.com/33553-large_default/casquette-baseball-flexfit.jpg,,Accessoires,Couvre-chef,
1d504b7f-d6c0-4fb7-a26f-9eeea0f437ed,VANOS,215167,,22/11/2023,Casquette Baseball Contractor,https://www.quaerius.com/16069-large_default/casquette-baseball-contractor-fostex-garments.jpg,"La Casquette Baseball Contractor Fostex Garments est simple et légère, elle dispose d'un velcro sur le front pour y placer un patch.",Accessoires,Couvre-chef,
c7e45ecb-1af2-4df7-974c-f037a8e06c9a,VANOS,215172,,29/11/2022,Casquette Enfant Camouflage,https://www.quaerius.com/33649-large_default/casquette-enfant-camouflage.jpg,,Accessoires,Couvre-chef,
33218600-ab5c-4f58-95eb-5e2d25401891,VANOS,215191,,29/11/2022,Casquette avec Protection de Cou,https://www.quaerius.com/33459-large_default/casquette-avec-protection-de-cou.jpg,,Accessoires,Couvre-chef,
11085b45-1fab-481d-b776-15550ea8ad19,VANOS,219277,,30/11/2022,Masque de Visage Airsoft en Nylon Grillagé,https://www.quaerius.com/15426-large_default/masque-de-visage-airsoft-en-nylon-grillage-101-inc.jpg,"Le Masque de Visage Airsoft en Nylon Grillagé 101 Inc., conçu pour la pratique de l'airsoft, est composé de nylon à 100% et dispose d'une grille au niveau du nez et de la bouche pour les protéger.",Accessoires,Masques,
8820f3e6-86ff-4f96-92fe-de59222af327,VANOS,219288,,30/11/2022,Masque de Protection Airsoft en Métal,https://www.quaerius.com/17908-large_default/masque-de-protection-airsoft-en-metal-101-incorporated.jpg,"Le masque de protection airsoft en métal 101 Incorporated est doté d'un grillage en métal, permettant de protéger la bouche, le nez, ainsi que les oreilles. Il dispose également, de 2 bandes élastiques ajustables pour un maintien optimal du masque.",Accessoires,Masques,
058cecf4-2d4c-4066-a95e-397f9cd120e4,VANOS,219292,,30/11/2022,Masque Néoprène Skull 3D,https://www.quaerius.com/15423-large_default/masque-neoprene-skull-3d-101-inc.jpg,Le Masque Néoprène Skull 3D 101 Inc. est conçu pour protéger du froid et de la pluie. Il représente une mâchoire de squelette.,Accessoires,Masques,
715876a7-bb0f-49cc-bcae-dfee38d0a8b7,VANOS,221231,"3XL/KAKI, 3XL/NOIR, L/KAKI, L/NOIR, M/KAKI, M/NOIR, S/KAKI, S/NOIR, XL/KAKI, XL/NOIR, XS/KAKI, XS/NOIR, XXL/KAKI, XXL/NOIR",22/11/2022,Gants Tactical Neoprene,https://www.quaerius.com/34777-large_default/gants-tactical-neoprene.jpg,,Accessoires,Gants,
999b1a22-2802-4e31-9875-00d128808e1c,VANOS,241330,,22/11/2022,Ceinture en Tissu Navy Seal,https://www.quaerius.com/17633-large_default/ceinture-en-tissu-navy-seal-101-incorporated.jpg,"La ceinture en tissu Navy Seal 101 Incorporated est composée de coton et possède une boucle métallique amovible imprimé du logo des Navy Seals (les forces spéciales de la marine). Cette ceinture est, de plus, robuste et pratique grâce à son système de réglage.",Accessoires,Ceintures,
326e5b8d-0b70-4c43-9961-8a328e124b22,VANOS,241331,,22/11/2022,Ceinture en Tissu De Oppresso Liber,https://www.quaerius.com/17650-large_default/ceinture-en-tissu-forces-speciales-de-oppresso-liber-101-incorporated.jpg,"La ceinture en tissu De Oppresso Liber 101 Incorporated possède une sangle en coton et une boucle métallique amovible. Sur celle-ci, on retrouve une tête de mort sur laquelle s'enroule un serpent et la devise des forces spéciales de l'armée américaine (surnommées les ""bérets verts"") : ""De Oppresso Liber"" signifiant ""libérer de l'oppression"".",Accessoires,Ceintures,
d65eaa86-f19f-4b9b-bba8-3b94372954bd,VANOS,241332,,22/11/2022,Ceinture en Tissu Airborne,https://www.quaerius.com/17635-large_default/ceinture-en-tissu-airborne-101-incorporated.jpg,"La ceinture en tissu Airborne 101 Incorporated est une ceinture en coton dotée d'une boucle métallique amovible. On retrouve apposé, sur celle-ci, l'emblème de la 101e division aéroportée (101st airborne division), une division d'infanterie de l'armée américaine formée aux opérations d'assaut aérien.",Accessoires,Ceintures,
b88d44be-753e-4bc7-bf02-5fda29b7484c,VANOS,241333,,22/11/2022,Ceinture en Tissu US Marines,https://www.quaerius.com/17638-large_default/ceinture-en-tissu-us-marines-101-incorporated.jpg,"La ceinture en tissu US Marines 101 Incorporated est une ceinture en coton. Elle dispose d'une boucle en métal amovible pouvant se régler à votre convenance. Cette boucle métallique est, de plus, imprimé de l'emblème du corps des marines des États-Unis.",Accessoires,Ceintures,
20a364a1-3bdb-4b68-9ef3-79c4d7c28551,VANOS,241334,,22/11/2022,Ceinture en Tissu Skull,https://www.quaerius.com/17656-large_default/ceinture-en-tissu-skull-101-incorporated.jpg,"La ceinture en tissu Skull 101 Incorporated est une ceinture en coton dotée d'une boucle métallique amovible. Une tête de mort sur une étoile est également imprimée sur cette même boucle. La ceinture dispose, de plus, d'un système de serrage rapide et sa conception 100% coton lui confère une grande résistance.",Accessoires,Ceintures,
ab37fa6d-d5c0-4057-9339-e31cb617f26b,VANOS,241335,,22/11/2022,Ceinture en Tissu Force Recon,https://www.quaerius.com/17662-large_default/ceinture-en-tissu-force-recon-101-incorporated.jpg,"La ceinture en tissu Force Recon 101 Incorporated est faite à partir de coton la rendant très résistante. Elle possède, de plus, un système de serrage rapide grâce à sa boucle métallique amovible. Une tête de mort ailée portant un masque de plongée et l'inscription ""Force Recon Swift Deadly Silent"" signifiant ""Force Recon, Rapide, Mortelle, Silencieuse"" sont imprimées sur la boucle.",Accessoires,Ceintures,
d588b7c0-762c-4d98-8236-cc95bb528ee8,VANOS,241336,,22/11/2022,Ceinture en Tissu US,https://www.quaerius.com/17644-large_default/ceinture-en-tissu-us-101-incorporated.jpg,"La ceinture en tissu US 101 Incorporated est une ceinture dotée d'une sangle en coton. Elle dispose également, d'une boucle en métal noire amovible estampillée US.",Accessoires,Ceintures,
ffa2ba74-c100-4727-991f-ba6ecc148cf4,VANOS,241337,,22/11/2022,Ceinture en Tissu 101 INC,https://www.quaerius.com/17666-large_default/ceinture-en-tissu-101-inc-101-incorporated.jpg,"La ceinture en tissu 101 INC 101 Incorporated est constituée de fibres de coton et possède une boucle métallique amovible gravée d'un logo de la marque 101 Incorporated. Elle dispose, de plus, d'un système de serrage permettant de l'ajuster à votre convenance.",Accessoires,Ceintures,
b5bdb8ce-d54f-4d2c-8f3c-e11b186e4fa7,VANOS,241338,,22/11/2022,Ceinture en Tissu 82nd Airborne Division,https://www.quaerius.com/16979-large_default/ceinture-en-tissu-82nd-airborne-division-101-inc.jpg,"La ceinture en tissu 82nd Airborne Division 101 Inc est composée de fibres 100% coton et dispose d'une boucle métallique amovible gravée du logo de la 82ème division aéroportée des États-Unis. Elle possède également, un système de réglage très fonctionnel, permettant d'ajuster la ceinture à votre convenance.",Accessoires,Ceintures,
db71d2b3-5d04-4dd2-9650-d4667b11f77e,VANOS,241340,,22/11/2022,Ceinture en Tissu USAF WWII,https://www.quaerius.com/16973-large_default/ceinture-en-tissu-usaf-wwii-101-inc.jpg,"La ceinture en tissu USAF WWII 101 Inc est constituée de fibres de coton et possède une boucle métallique amovible gravée d'un logo de l'USAF au style très vintage. Son système de réglage est, de plus, très pratique car il permet d'ajuster la ceinture à votre convenance.",Accessoires,Ceintures,
7e503ca0-172a-4b3a-86f0-6d8732e8ba86,VANOS,241341,,22/11/2022,Ceinture en Tissu US Paratrooper,https://www.quaerius.com/16967-large_default/ceinture-en-tissu-us-paratrooper-101-inc.jpg,"La ceinture en tissu US Paratrooper 101 Inc est faite en coton et possède une boucle métallique amovible apposée du logo Us Paratrooper. Elle dispose également, d'un système de réglage, très pratique, permettant d'ajuster la ceinture à votre morphologie.",Accessoires,Ceintures,
c820a217-193b-4877-b0cc-c7e838d2b30e,VANOS,241342,,22/11/2022,Ceinture en Tissu US Air Force,https://www.quaerius.com/16962-large_default/ceinture-en-tissu-us-air-force-101-inc.jpg,"La ceinture en tissu US Air Force 101 Inc est composée de fibres 100% coton et possède une boucle métallique amovible gravée du logo Us Air Force. Elle est, de plus, très robuste et pratique grâce à son système de réglage.",Accessoires,Ceintures,
39973243-ad1f-4b26-bcf2-20a4d9a34bfc,VANOS,249560,,30/11/2022,Sangle Fusil 1 Point de Fixation,https://www.quaerius.com/16758-large_default/sangle-fusil-1-point-de-fixation-101-inc.jpg,"La sangle fusil 1 point de fixation 101 Inc est composée de nylon assurant résistance et robustesse. Elle dispose d'une sangle avec une partie rigide permettant un maintien optimal. La sangle est, de plus, ajustable et élastique ce qui lui confère aisance lors de son port.",Autres,,
05377d04-fe9d-4eaa-addb-315e79d0ff49,VANOS,259292,,23/11/2023,Sangle Réglable Strike Original,https://www.quaerius.com/35828-large_default/sangle-reglable-strike-original.jpg,,Autres,,
9df9218d-ab19-46ab-8f04-8bec4c3d46c0,MP-SEC,310535,,25/11/2022,Zephyr GTX Mid TF femme,https://www.catalogue.mp-sec.fr/media/catalog/product/cache/2/image/9df78eab33525d08d6e5fb8d27136e95/l/o/low-310537-0731_v2_1.jpg,"Chaussure légère, robuste et exceptionnellement confortable pour une utilisation sur terrain modéré. Elle est dotée d'une membrane imper-respirante en Gore-Tex® adaptée pour les zones à climat tempéré à chaud pour garder les pieds au sec. Elle est idéale pour une utilisation militaire ou outdoor sur un terrain peu accidenté.",Chaussures,,
17fa8919-6dfc-460d-97e0-272eb88a410d,VANOS,319415,,24/11/2022,Seau à Eau US,https://www.quaerius.com/17621-large_default/seau-a-eau-us-armee-americaine-seconde-guerre-mondiale-101-incorporated.jpg,Le seau à eau US 101 Incorporated est un seau en toile estampillé US. Ce seau à eau est une reproduction des seaux utilisés par l'armée américaine pendant le Seconde Guerre Mondiale. Ils étaient le plus souvent accrochés aux véhicules lors des missions ou utilisés dans les campements.,Autres,,
b32498e4-5735-4b0e-8794-a8556bdccf4b,VANOS,319438,,22/11/2022,Corde On Roll 3 mm 60 m,https://www.quaerius.com/34542-large_default/corde-on-roll-3-mm-60-m.jpg,,Autres,,
44f9dd3b-80b9-4b4f-b94c-77da2677c05b,VANOS,353633,,19/11/2022,Musette Hollandaise,https://www.quaerius.com/16567-large_default/musette-hollandaise-fosco-industries.jpg,La Musette Hollandaise Fosco Industries est composée d'une poche simple fermée par sangles. Elle se porte en bandoulière.,Accessoires,Sacs,
7ce47b1e-9b89-4e4e-83a7-076d89f6513b,VANOS,353640,,22/11/2022,Sac en Toile US Air Force WWII Series,https://www.quaerius.com/16223-large_default/sac-en-toile-us-air-force-wwii-series-fostex.jpg,Le Sac en Toile US Air Force WWII Series Fostex est un sac à bandoulière léger et en toile à utilisation quotidienne. Il arbore l'insigne de l'armée de l'air américaine.,Accessoires,Sacs,
3fc998bc-bac0-4920-b3f8-2ec86ebc288f,VANOS,353641,,22/11/2022,Sac en Toile Royal Air Force WWII Series,https://www.quaerius.com/16213-large_default/sac-en-toile-royal-air-force-wwii-series-fostex.jpg,"Le Sac en Toile Royal Air Force WWII Series Fostex est un sac à bandoulière à utilisation quotidienne. En toile, il est bleu marine et arbore l'insigne de l'armée de l'air britannique.",Accessoires,Sacs,
ed16b4d9-7610-4e1f-ab7f-685e97e8fd9a,VANOS,353642,,22/11/2022,Sac en Toile D-Day 82nd Airborne WWII Series,https://www.quaerius.com/16203-large_default/sac-en-toile-d-day-82nd-airborne-wwii-series-fostex.jpg,Le Sac en Toile D-Day 82nd Airborne WWII Series Fostex est un sac à bandoulière arborant l'insigne de la 82ème Aéroportée américaine. Le sac est en toile et pour un usage quotidien.,Accessoires,Sacs,
a9d91b58-363b-46f7-9559-5bb4d9bc7b5e,VANOS,353643,,19/11/2022,Sac en Toile D-Day 101st Airborne WWII Series,https://www.quaerius.com/16193-large_default/sac-en-toile-d-day-101st-airborne-wwii-series-fostex.jpg,Le Sac en Toile D-Day 101st Airborne WWII Series Fostex est un sac à bandoulière en toile d'usage quotidien arborant l'insigne de la 101ème Aéroportée américaine.,Accessoires,Sacs,
b0ec52e1-059a-4d16-98fb-1a4fb842bab9,VANOS,353644,,22/11/2022,Sac en Toile D-Day 1944 WWII Series,https://www.quaerius.com/16183-large_default/sac-en-toile-d-day-1944-wwii-series-fostex.jpg,Le Sac en Toile D-Day 1944 WWII Series Fostex est un sac à bandoulière en toile pour le quotidien avec impression Deuxième Guerre Mondiale.,Accessoires,Sacs,
7c296992-188e-4d53-88cb-65d00a926073,VANOS,353645,,30/11/2022,Sac en Toile US Style,https://www.quaerius.com/35791-large_default/sac-en-toile-us-style.jpg,,Accessoires,Sacs,
6eece389-b50e-4541-b47f-0958aa2712de,VANOS,359332,,18/11/2022,Sac Parachutiste Armée Française,https://www.quaerius.com/16348-large_default/sac-parachutiste-armee-francaise-101-inc.jpg,"Le Sac Parachutiste Armée Française 101 Inc est un sac de transport simple et résistant : un grand compartiment fermé par glissière, avec sangles et poignées de transport en Cordura®. Marquage ""Armée Française"".",Accessoires,Sacs,
8425fc44-44f1-46f8-83e7-c4b43320a0d3,VANOS,359333,,18/11/2022,Sac Parachutiste Armée Française,https://www.quaerius.com/16348-large_default/sac-parachutiste-armee-francaise-101-inc.jpg,"Le Sac Parachutiste Armée Française 101 Inc est un sac de transport simple et résistant : un grand compartiment fermé par glissière, avec sangles et poignées de transport en Cordura®. Marquage ""Armée Française"".",Accessoires,Sacs,
8f7c81ce-96a9-472f-a2e5-cb58f9cb4cd7,VANOS,359384,,14/04/2023,Sac Banane à Bandoulière EDC,https://www.quaerius.com/16244-large_default/edc-sac-banane-a-bandouliere-task-force-2215.jpg,Le Sac Banane à Bandoulière EDC TF2215 est une banane bandoulière qui permet d'emporter les documents essentiels dans un sac résistant en Cordura 500D.,Accessoires,Sacs,
5474853e-29be-409a-9b78-a79006d231a1,VANOS,359413,,30/11/2022,Sac Fusil Raptor,https://www.quaerius.com/35799-large_default/sac-fusil-raptor.jpg,,Accessoires,Sacs,
abb9285a-91c5-47a9-b1aa-e94f3bd17e0d,VANOS,359432,,30/11/2022,Sac Pistolet Double,https://www.quaerius.com/35810-large_default/sac-pistolet-double.jpg,,Accessoires,Sacs,
5a5a887c-1a27-4b42-a289-f34dd323812b,VANOS,359502,,23/11/2022,Sac Para 2,https://www.quaerius.com/16120-large_default/sac-para-2-fostex-garments.jpg,Le Sac Para 2 Fostex Garments est un sac pilote imitant le style des parachutes militaires à ouverture automatique avec 1 grand compartiment principal et deux anses de portage.,Accessoires,Sacs,
47fdc8e4-ecc5-4956-9e09-b00b4932cdb3,VANOS,359503,,18/11/2022,Sac Para 3,https://www.quaerius.com/16133-large_default/sac-para-3-fostex-garments.jpg,Le Sac Para 3 Fostex Garments est un sac cartable imitant le style des parachutes militaires à ouverture automatique. Il se porte en bandoulière.,Accessoires,Sacs,
20c2d81c-2ccc-49af-8b8d-af6e82ac952c,VANOS,359504,,23/11/2022,Sac Para 4,https://www.quaerius.com/16144-large_default/sac-para-4-fostex-garments.jpg,Le Sac Para 4 Fostex Garments est un sac cartable en hauteur se portant en bandoulière ou à la main par les anses. Il imite le style des parachutes militaires à ouverture automatique.,Accessoires,Sacs,
b01e2036-2393-4f4d-9df9-2e4b1a6e5023,VANOS,359505,,23/11/2022,Sac Para 5,https://www.quaerius.com/16149-large_default/sac-para-5-fostex-garments.jpg,Le Sac Para 5 Fostex Garments est un sac à dos imitant le style des parachutes militaires à ouverture automatique.,Accessoires,Sacs,
daa8eb57-c4de-4588-b748-7716d2701e04,VANOS,359506,,23/11/2022,Sac Para 6,https://www.quaerius.com/16160-large_default/sac-para-6-fostex-garments.jpg,"Le Sac Para 6 Fostex Garments est un sac à dos, légèrement plus petit que le Sac Para 5, imitant le style des parachutes militaires à ouverture automatique. C'est l'un des sacs parachute les plus répandus.",Accessoires,Sacs,
3239dac2-e405-4e21-b58a-3abae22ceef4,VANOS,359548,,18/11/2022,Poche Téléphone Mobile Avec Rabat,https://www.quaerius.com/35365-large_default/poche-telephone-mobile-avec-rabat.jpg,,Autres,,
073eaddf-0c51-46da-93d3-47a4eb49879b,VANOS,359555,,23/11/2023,Poche Medic Avec Boucle Rip Off Large,https://www.quaerius.com/35337-large_default/poche-medic-avec-boucle-rip-off-large.jpg,,Autres,,
7cadbae1-b1c6-4369-b7fa-3c2e3998051f,VANOS,359561,,14/04/2023,Sac à Bandoulière EDC,https://www.quaerius.com/16234-large_default/edc-sac-a-bandouliere-task-force-2215.jpg,"Le Sac à Bandoulière EDC TF2215 est idéal pour une utilisation au jour le jour. Ses deux compartiments permettent d'emporter l'essentiel (téléphone, portefeuille, billets, etc.), dans un sac résistant en Cordura 500D.",Accessoires,Sacs,
3df1b9d9-4793-4bcd-a348-300a26d0412e,VANOS,359630,,19/11/2022,Porte Documents Admin Panel Cordura,https://www.quaerius.com/35573-large_default/porte-documents-admin-panel-cordura.jpg,,Autres,,
a325eb21-4b77-44a7-8897-1760e743734e,VANOS,359800,,24/11/2022,Poche pour Recharge Billes Airsoft,https://www.quaerius.com/17767-large_default/poche-pour-recharge-billes-airsoft-101-incorporated.jpg,"La poche pour recharge billes Airsoft 101 Incorporated est une poche en nylon permettant l'emport de votre recharge de billes. Cette poche peut se fixer sur votre ceinture, votre gilet ou encore votre sac à dos, grâce à des sangles à l'arrière de celle-ci. Elle possède également une fermeture par zip et un cordon de serrage pour un maintien optimal de votre équipement.",Airsoft,,
da86a293-dffb-4ad1-9cc7-f26318446f9e,VANOS,359806,,24/11/2022,Poche MOLLE Grenade,https://www.quaerius.com/35347-large_default/poche-molle-grenade.jpg,,Autres,,
622f55f0-cc18-48f8-8865-e6c6a95956fb,VANOS,359808,,24/11/2022,Double Porte-Chargeur,https://www.quaerius.com/16729-large_default/double-porte-chargeur-101-inc.jpg,"Le double porte-chargeur 101 Inc possède deux compartiments composés de nylon, matière réputée pour sa résistance et sa capacité de séchage rapide. Il dispose également d'une ouverture simple et d'un élastique assurant le maintien de votre équipement. Vous pourrez le placer à n'importe quel endroit pourvu de passants MOLLE.",Autres,,
6777c14c-db07-40c9-94ca-5a9fdd3d25ae,VANOS,359813,,24/11/2022,Poche MOLLE Bouteille,https://www.quaerius.com/35344-large_default/poche-molle-bouteille.jpg,,Autres,,
37fcb5d9-fcd9-4276-ae0e-31e3b1c9d5a2,VANOS,359824,,19/11/2022,Poche Système Molle,https://www.quaerius.com/17778-large_default/poche-systeme-molle-101-incorporated.jpg,La poche système molle 101 Incorporated a été conçue pour l'emport de matériel. Elle est fait en nylon et dispose d'une fermeture rapide par zip. Cette poche est également dotée de passants molle permettant une fixation facile à votre équipement.,Autres,,
bd1f9cd9-9f36-4ea1-8899-e7fa366d422b,VANOS,359825,,24/11/2022,Poche Médicale IFAK (sans croix rouge),https://www.quaerius.com/17782-large_default/poche-medicale-ifak-sans-croix-rouge-101-incorporated.jpg,"La poche médicale IFAK (sans croix rouge) 101 Incorporated a été conçue pour l'emport de matériel médical. Elle dispose d'une fermeture zip, de passants molle à l'arrière et d'un compartiment en mesh sur le devant.",Autres,,
af779e64-4f00-46a6-8f2f-94c0420afa29,VANOS,359855,,24/11/2022,Porte Chargeur M4 Triple avec Elastique,https://www.quaerius.com/35411-large_default/porte-chargeur-m4-triple-avec-elastique.jpg,,Autres,,
0b121f93-825e-4ce4-91d2-e85713277cd1,VANOS,359857,,24/11/2022,Porte Chargeur M4 Triple Open Top,https://www.quaerius.com/35413-large_default/porte-chargeur-m4-triple-open-top.jpg,,Autres,,
4e3aa9e4-a74b-4068-bd5f-167327839be8,VANOS,359858,,24/11/2022,Porte Chargeur M4 Triple Stacker,https://www.quaerius.com/35414-large_default/porte-chargeur-m4-triple-stacker.jpg,,Autres,,
b091d548-542e-4fcb-979e-f66cea9db1bd,VANOS,359942,,22/11/2023,Poche Contractor Cordura,https://www.quaerius.com/35323-large_default/poche-contractor-cordura.jpg,,Autres,,
